Sentence,totalwords
sp this video is for information purposes only and it is not a recommendation to buy or sell any securities,20
sp sp sp sp sp the company specializes in the construction and integrity of pipelines and oil and gas facilities,20
sp sp sp sp sp sp sp sp sp sp sp the sp clients include talisman transcanada spectra and pembina,20
sp sp sp sp sp sp sp revenue has grown from million in to million in substantially through organic efforts,20
will encourage further development of natural gas resources which includes associated well site water lines natural gas and processing facilities,20
in several multi million dollar contracts for pipeline and facilities construction business for macro once final investment decisions are announced,20
sp sp i want to talk to you about and ultra huge no no when it comes to using humor,20
sp sp sp sp sp sp sp sp just too great of a risk and it is socially unacceptable,19
sp sp sp sp sp sp sp sp sp as a utility brand still new in the social media space,20
so engage in a social media environment that we have the resources available that can follow up with that consumer,20
and being a good brand partner to our customers when they want to learn more about our products and services,20
sp sp sp sp sp sp sp sp sp sp sp sp sp for the complete article please go to,20
sp sp sp sp sp sp sp sp sp sp sp sp sp for the complete article please go to,20
sp sp sp as the law moves forward game on for those organizations that were sitting on the fence,19
think the first thing crossing sp minds is that sp almost a sigh of relief due to the certainty now,20
sp sp sp sp sp sp sp sp my name is isaiah mueller and im the president and of volkswagen,20
have supported us all existing volkswagen cars would enjoy a complimentary car maintenance courtesy of volkswagen from any authorized dealer,20
hand with the authorities to come up with a solution that we will release to you through our official website,20
we are very sorry and to show how sorry we are up next super junior with the song sorry sorry,20
we are very sorry and to show how sorry we are up next super junior with the song sorry sorry,20
sp sp sp sp sp sp sp sp sp sp sp yes tell anybody about our magic coffin shh,19
sp sp sp sp sp sp sp sp sp sp sp sp coffin a secret now yes tell,18
with you there at but sp in production on our new series rhett and sp buddy system it is a,20
sp sp sp sp sp sp hey rhett and link here just hanging out in our magic coffin we really,20
sp sp sp sp coffin and a fight and a barbershop quartet that we sing with clones of ourselves and,20
a scripted musical comedy which features a lot of totally normal things the least of which is this magic coffin,20
sp sp sp sp sp sp bike actually definitely a talking exercise bike because that is also in there and,20
sp sp sp sp sp sp sp sp sp sp sp sp sp ourselves and possibly a talking exercise bike,20
sp super excited to be working with to bring this to our fans on the platform via red so look,20
sp sp sp sp sp sp sp sp sp sp sp in there and lots of other stuff sp super,20
sp sp sp sp red in the meantime sp gonna be hanging out in our secret magic coffin a,19
sp sp sp sp red so look for rhett and sp buddy system this year on red in the meantime,20
sp sp sp sp sp sp sp sp then it is time to repent and give yourself fully to jesus,20
sp sp i am calling you to be holy as i am friend is your sin blocking you from heaven,20
sp sp sp sp sp he will lead you and he will speak to you if you remove the block,20
sp sp sp sp a lot of christians understand why it is that jesus does not speak to them,19
sp sp sp sp sp sp sp sp sp sp sp sp sp sp sp sp sp jesus bless you,20
let's them do what their desires dictate them to doi am holy and to follow me you must be holy,20
sp sp sp sp sp sp the reason why you are blocked off from me is because of your sin,20
much in my kingdom but in sin you are not with me and will not achieve the righteousness of god's,20
sp sp sp sp sp sp sp sp i guess on leap year it would be edi but oh point,20
create an environment that is equitable and that gives everybody a chance to make their contribution the most productive way,20
workforce diversity puts us in a place to emphasize this area of diversity and inclusion in new and creative ways,20
sp sp sp sp we are in a circumstance here of kind of running a small town a wonderful town,20
sp sp sp sp sp sp sp sp sp sp sp sp sp sp what edi is all about,19
estate they would not be a good credit risk to a bank and could not in fact get any money,20
sp sp this is patrick munro talking about real estate and its relation to you if you have bad credit,20
sp sp this is patrick munro talking about real estate and its relation to you if you have bad credit,20
sp without them there is one other aspect of this whole thing though which is less than completely ideal and,20
sp sp sp sp sp sp sp ideal and that it does make me feel a little old no glasses,20
sp sp sp sp sp sp sp sp worth i know that i chose the best possible frames i might,20
sp sp sp sp sp sp sp sp sp frames i might upgrade those at some point and i definitely,20
as you can see they have a tendency to reflect the lights i use to make my videos but overall,20
sp sp sp sp videos but overall yeah i like myself better with glasses than without them there is one,20
i feel like a lot more likely to take you seriously if you do have glasses than if you but,20
know this sounds kind of i feel like the glasses complete my face in this weird way like never really,20
like never really hated the way i look but never thought i was super good looking either and the glasses,20
glasses have definitely caused an improvement in my concept of my own self image whatever worth i know that i,20
sp sp you already and i wanted to remind you got these sweet new mystic t shirts you can get,20
shirts you can get one by clicking on the little picture of them right down there thank you so much,20
sp sp sp sp sp with it and that is all sp got for you today rebel make sure to,20
sp sp sp sp sp sp sp today rebel make sure to subscribe if you already and i wanted to,20
sp sp sp sp in oregon sp probably gonna be getting our own house in the not future if the,20
move into my new bespectacled life as a middle aged man sort of okay with it and that is all,20
also made me realize that pretty okay with where i am at this point in my life i make a,20
and three wonderful children we got a real nice house in a real nice town in oregon sp probably gonna,20
sp sp sp sp sp back to my life i did get a haircut thanks for noticing no but clearly,20
sp sp sp sp sp sp sp sp sp hello rebel and welcome back to my life i did get,20
sp sp sp sp sp sp sp sp sp noticing no but clearly something is different on my face right,20
goatee better because i find it very and she kind of went silent for a really long time like so,20
sp sp sp sp sp sp sp sp sp sp sp sp sp right growing my beard back turns out,20
but yeah she said she likes the full beard better and i like it too so coming back also i,20
i had accidentally complimented the good looks of another woman instead of like my own facial hair but yeah she,20
sp sp sp sp sp glasses this is still a little weird not entirely used to it like i keep,20
sp sp sp sp sp sp sp sp sp sp sp sp sp coming back also i got glasses this,20
that i have a mild astigmatism which makes long distance vision a little bit blurry especially at night the optometrist,20
higher level of blur than i had previously experienced in my life which was like none so the day after,20
driving at night the headlights and tail lights of the other cars were getting a little bit blurry it anything,20
to adjust my glasses when they slide down my nose and every time like my god's sp adjusting my so,20
sp sp sp shock the way i feel exactly a mid life crisis but kind of akin to one but,20
sp sp sp sp sp sp glasses not probably never gonna get over that system shock the way i feel,20
sp sp sp time now the first day i got my glasses i was a little bit down always had,20
them on everything became so much clearer that i just wear them all the time now the first day i,20
glasses since before i was born so this is not some like huge surprise out of nowhere it was pretty,20
sp sp sp down always had perfect vision and so it felt in a sense like i was that but,20
gotten used to wearing them i found out that i actually really like how they look i mean for one,20
sp sp sp sp sp sp sp sp sp sp sp nowhere it was pretty much inevitable and after that,20
sp sp sp sp old people a lot of kids wear glasses from a very young age my son luke,20
sp sp sp sp sp sp sp old no glasses are not exclusive to old people a lot of kids,20
one of my old videos which i do every once in a while and see myself without the glasses not,20
sp sp sp sp sp sp sp sp sp sp sp sp glasses it happened because i got old which,20
sp sp sp sp sp sp sp sp sp sp probably but i born with eyes that needed glasses it,20
he will almost definitely need glasses growing up and finally of the age where he will probably not break them,20
really is helpful to them as opposed to advertising at them the way that we have seen in the past,20
sp sp sp sp sp so those are the things that you want to listen for with regards to language,20
sp sp sp sp sp sp sp sp was it a sweater or was it a red tattered stained sweater,20
expects throughput to achieve tonnes per day by the end of the year as both main veins contribute to production,20
sp sp sp sp sp sp for more information please visit the sp website call neil macrae at or email,20
sp sp sp sp sp sp sp sp sp sp sp sp their branches are listed on their website at,20
more information about jennings capital or to obtain a copy of their research report contact your nearest jennings capital office,20
sp this video is for information purposes only and it is not a recommendation to buy or sell any securities,20
sp this video is for information purposes only and it is not a recommendation to buy or sell any securities,20
reiterated his buy rating and month target of a premium of to the price the day the report was issued,20
its san felipe project in sonora state confirmed the continuity of a new vein both along strike and to depth,20
mexico has the producing rosario project two advanced stage projects the san and and an early stage exploration project el,20
sp this video is for information purposes only and it is not a recommendation to buy or sell any securities,20
stated the confirmation that the surface of the vein appear well along strike and to depth indicate a highly system,20
drilling has traced the strike at to and a depth of and it remains open along strike and at depth,20
can check in with these videos every single week and i can give you advice and we can do this,20
sp sp sp sp sp sp sp sp sp sp thank you for watching and sp see you next time,20
be really helpful with checking in and making sure staying on track with what you want to do so,19
to share your story with the world and so sp taking my own advice here starting this new channel sp,20
sp sp new channel sp adrienne sp this is my new channel about digital marketing strategy for musicians as sp,20
know what the one thing going to do towards starting that this week is in the comments as well,19
or starting a channel or running an ad campaign for your next record coming out just start i think,19
their work online and grow their audience and grow their engagement digital strategy is to just start not it this,20
see if sp actually clicking on your ad if sp actually buying the thing you want them to buy you,20
then you look back and months have passed and you still sp done the thing that you want to do,20
burn ad campaign you learn a lot from it and your next sp gonna to be better once you get,20
sp sp sp sp sp sp sp sp you get the stats right away great even if you have,19
it out to your huge list and sp no response or the response sp what you wanted it can be,20
sp sp sp sp sp sp sp sp sp sp sp better once you get started just keep going can,20
sp sp sp sp sp sp sp sp sp sp sp sp sp sp sp so just keep going ways,20
disappointing and so hard to try again if it have the response that you wanted it to have,18
the goals that you want because we all sort of by default if things get stressful do stuff and,19
ways that i keep going with my projects and i advise to my clients is just concept of accountability can,20
want to post to eight times a week or you want to post a new channel once a week set,20
your brain to make it happen accountability and one way that sp done that to just set a schedule maybe,20
sp sp sp sp sp sp sp sp sp sp it can also come from connection with another person could,20
sp sp sp sp sp sp week set a schedule that seems reasonable for you and then just do it,20
to see if sp doing what they need to be doing and how you can do better the next week,20
that you get stuff done before your next call with them and sort of like sp got that assignment,19
sp sp sp sp sp sp similar work you can get on the phone once a week i really think,20
sp sp sp sp or just a colleague or a friend sp doing similar work you can get on the,20
develop the points and make sure very easy to listen to and gives your listener a call to action,19
develop the points and make sure very easy to listen to and gives your listener a call to action,19
the speech by connecting to an issue going to be of interest to them and of importance to them,19
develop the points and make sure very easy to listen to and gives your listener a call to action,19
sp sp sp sp now the development of your speech is going to be a lot like developing an essay,20
careful about how you use humor in your speech because it can actually end up doing more harm than good,20
sp sp sp sp sp sp sp sp sp jack tells the camera something he will never ever forget he,20
sp sp sp sp she unfortunately passed away some weeks later with her battle with her illness this is sad,20
means that she has forgotten that he had actually been talking to her the whole time which is obviously heartbreaking,20
sp sp sp sp sp sp sp sp sp sp she was she was super like aware of everything oh,20
sp sp sp sp sp sp sp sp sp sp oh god's sorry gonna sound terrible she was super,19
has to translate into an order is really becoming a critical component of what people respond to in marketing messages,20
start that starting to see is this need to understand as the marketer when to solve and when to sell,20
sp sp sp sp sp sp sp also be working at the cid booth so stop by and say hi,20
sp sp sp sp sp sp sp sp so excited to travel to the ag bell convention in denver co,20
to help families support their children with homework as well as provide professionals resources to help the families they serve,20
sp sp sp sp sp sp sp sp sp sp sp sp sp sp sp sp see you in denver,20
sp sp sp sp sp sp sp sp sp sp sp sp sp sp sp sp see you in denver,20
sp sp your case can be completed very inexpensively using our services you can save about versus hiring an attorney's,20
sp sp there are no court hearings if you and your spouse agree or the other party does not respond,20
for a nevada annulment we can also process a dominican republic divorce that is valid for residents of many states,20
sp sp sp sp our friendly and knowledgeable staff is waiting to answer all your questions including evenings and weekends,20
sp sp sp sp sp sp sp please visit our website at call us at or view our other videos,20
sp sp sp we would like to help you with your divorce or annulment and can provide same day service,20
sp sp sp sp our friendly and knowledgeable staff is waiting to answer all your questions including evenings and weekends,20
sp sp sp sp established in we are the first online divorce company in nevada and our services are guaranteed,20
paralegal firm on the internet that is attorney's supervised and is accredited by the better business bureau with an rating,20
all the work including preparing the papers filing the documents with the court and returning the finalized decree to you,20
sp sp sp sp sp you have enough to worry about so let's our caring and helpful staff assist you,20
sp sp if your spouse is not willing to sign or cannot be located we can file a complaint action,20
sp sp sp sp sp sp sp sp easy for you to lose some objectivity about what sp written,19
order it today at the link below but also pick up our free e books up the home page of,20
order it today at the link below but also pick up our free e books up the home page of,20
sp sp sp sp sp i use spell check rely on spell check for grammar checking or catch errors,19
sp sp for more great tips about proofreading and preparing reports get my book honing your legal nurse consulting skills,20
sp sp sp sp sp sp sp it greatly increases sp stress level including the attorney's as well as yourself,20
sp sp sp sp sp writing and proofreading your report at the last minute may cause you to miss things,20
a knowledgeable and trusted person look at your report for anything that needs to be changed before it is submitted,20
sp sp sp sp sp sp sp this is jessica smith and these are the benefits of investing in cds,20
sp sp sp sp sp sp sp this is jessica smith and these are the benefits of investing in cds,20
do have to pay taxes on it unless in an ira or a and then deferred until retirement,18
guys and gals over at to kind of help me out so that for us is a very good benefit,20
sp sp sp sp very hard as far as marketing is concerned sp a lot of noise out there,19
do take the time to manage out a strategy and a course to get the best customer for our pipeline,20
sp sp sp sp sp sp sp sp sp thanks for spending time with me at frank desert car care,20
sp sp sp so i want to tell you we plan on being with for many many years to come,20
our ethics our standards our master technicians the shop equipment that we have on board a customer for us,19
sp sp sp sp sp if considering please give me a call my name is frank desert car care,19
sp sp sp so check out i really think you will be in good company and we highly recommend them,20
sp i want to talk to you a little bit about today and how they help with auto shop advertising,20
we have auto repair stores on dobson and chandler boulevard as well as in gilbert williams field and val vista,20
a pretty rigid set of guidelines that we certainly want to be a part of ultimately as a consumer tool,20
sp sp our company has been members of for going on almost six years and sp very proud members,19
company in sp economic climate of competitive nature that exists in our market we sure do enjoy being part of,20
other car repair shop owners that we can network with hashing out new auto repair advertising ideas and marketing ideas,20
sp sp sp sp sp sp sp sp sp thanks for spending time with me at frank desert car care,20
increasingly whether search engines or other portals or more niche applications recognizing that as you know gonna be a given,20
increasingly whether search engines or other portals or more niche applications recognizing that as you know gonna be a given,20
sp sp sp sp sp sp sp sp sp sp sp whatever oh now i feel something but maybe your,20
start getting emotions engaged rather than just like intellect like ok i like this guy's because of whatever oh,19
sp sp sp sp sp sp sp feel something but maybe your channel is somewhat like mine and that not,20
channel actually about other people and what doing for them and how serving them and all of,17
sp sp sp are you talking about yourself and what doing and why so awesome for you or,18
sp sp sp sp sp sp sp sp sp channel and i want you guys to comment below what is,20
that comes down to what i would define as what is your mission for your channel and i want you,20
sp sp sp sp sp sp sp sp sp sp comment below what is your mission for your channel and,20
powerful tool for growing your channels because the strongest communities both online and they revolve around common interest they,19
what is your belief that compels you to make videos and to share what sharing on and by the,19
other people who share that belief with you will instantly form a much stronger human connection with you start,19
sp sp sp sp sp sp sp sp sp sp sp sp they actually revolve around shared beliefs and when,20
sp sp sp sp sp sp sp sp sp sp sp sp sp definitely think sp good at it and,20
sp sp sp sp michael clayton is a fixer and i sp really say that he enjoys his but i,20
sp sp sp sp sp sp sp sp sp sp sp sp sp sp sp sp family uhh sp sp,20
sp sp sp sp sp sp sp sp sp sp sp sp sp sp sp and sp got some family,20
sp sp sp sp sp sp sp sp sp doing so hot uhh cash in the beginning this i,19
sp sp sp sp sp sp sp sp sp sp sp sp sp sp sp sp sp sp sp not,20
sp sp sp sp sp sp sp sp sp sp sp sp sp sp sp sp know i i stutter,20
clooney as michael uhh sp like to state that this is michael clayton who is the of uhh court cases,20
sp sp sp sp sp sp sp sp line today what sp like to review is the movie michael starring,20
sp sp sp sp sp sp sp sp sp sp bay you go into it thinking a football uhh,19
sp sp sp sp sp sp sp sp sp sp sp and not michael clayton wide receiver for the tampa,20
sp sp sp sp sp sp sp sp sp to be in for a little surprise this movie i did,20
sp sp sp sp sp sp sp sp sp sp sp sp sp sp a football uhh definitely going,19
sp sp sp sp sp sp sp sp sp sp sp sp sp sp sp movie which i definitely would,20
sp sp whatsoever it was extremely long and boring to me it was like a a courtroom drama type movie,20
sp sp sp sp sp sp sp sp sp sp sp sp sp just my taste you might enjoy,19
sp sp sp sp sp sp sp sp sp sp sp sp sp sp sp sp sp sp sp but,20
sp sp sp sp sp sp sp sp sp sp sp sp sp sp sp sp sp sp really scandalous,20
sp sp sp if they relate to you or to something in your speech it will be memorable for them,20
data into tables extracting data that we want counting rows with and linking tables together using primary keys and joins,20
sp sp sp sp sp sp sp sp sp sp sp sp sp sp sp sp sp see you then,20
director i arrange internships with community based organizations working on social justice deepening democracy and promoting sustainability in the area,20
these for sociology elective credit and get to practice sociology in the community while making a difference in the process,20
get not only a lot of experience but an idea whether of that is the right career path for you,20
these for sociology elective credit and get to practice sociology in the community while making a difference in the process,20
sp sp sp sp because just because you sp met your goals yet mean that you sp going forward,19
sp sp sp sp sp sp but what we have to do is understand why you sp met them yet,20
sp sp sp sp sp sp get you those results that you want and i will see you next week,20
if the case then we need you to carve out some time every single week to move you forward,19
giving service and providing value that forgetting to take the time out to work on your business as well,19
sp sp sp sp sp sp get you those results that you want and i will see you next week,20
sp sp then we need that crystal laser like focus on the actions that are going to get you there,20
sp sp sp sp i am recording this at the end of the first quarter this year and sp curious,20
sp sp sp sp sp maybe ones that are even a little stretch beyond those that you had already set,20
sp sp sp sp sp sp sp sp thank you for making absorb health your mind body and spirit solution,20
sp sp sp sp sp sp sp sp thank you for making absorb health your mind body and spirit solution,20
sp sp sp sp sp sp sp sp sp sp sp every generation faces its own unique set of challenges,20
sp sp sp sp sp sp sp sp sp that the environmental challenge is the great challenge of our age,20
sp sp sp sp sp had folks sp worked to transition us to new technological forms through the industrial revolution,20
the past sp had folks sp worked to bring about greater civil rights for certain parts of the human population,20
sp this particular moment is really i think about making sure that human activities are ultimately compatible with ecological realities,20
sp sp had folks sp been in generations that have had to fight great wars against fascism and so forth,20
sp sp sp sp sp sp sp sp a quote from a guy's i know named david oren david and,20
sp sp sp sp sp sp sp sp sp sp sp if we sort this out nothing else matters,19
sp sp sp sp and during that workshop david said something that has stuck with me and resonated ever since,20
sp sp sp sp sp sp sp sp sp oren david and i taught a workshop together some years ago,20
connected very intimately to your individual liberty of conscience in choosing what to read what to think what to believe,20
sp sp sp sp sp sp sp sp sp sp sp i really have choice to go into that profession,20
simply are the physical social manifestations of the freedom of choice or freedom of conscience that we take so seriously,20
profession that i choose then it not make sense to say that i have the right to choose a profession,20
make transactions in the economic we are putting into physical reality in the social setting the choices that we make,20
sp sp sp sp sp sp so the reality is no distinction between civil liberties and economic liberties at all,20
simply are the physical social manifestations of the freedom of choice or freedom of conscience that we take so seriously,20
sp sp sp sp sp sp sp sp the truth is no real distinction between civil liberties and economic liberties,20
the same and a mistake to try to separate them out and defend one at the expense of the other,20
simply are the physical social manifestations of the freedom of choice or freedom of conscience that we take so seriously,20
the ideas i publish are punishable by death then i really have a substantial right to publish whatever i want,20
sp you have the right to seek information if the information allowed to come into existence in the first place,20
sp sp sp sp sp sp sp sp sp sp sp sp sp sp lesson plans for sp are important,20
