Sentence,totalwords
independence we are only bound by human rights that is our standard what we apply in our work we,19
sp sp sp sp we scrutinize what governments what parliaments do and for that you need independence we are only,20
sp sp sp sp sp sp sp sp sp sp sp sp sp sp independence is essential to our legitimacy,20
sp sp sp sp work we help the states to implement their obligations towards all human beings and their countries,20
us to do that effectively we need to be independent and we need to be perceived to be independent work,20
rights institutions was conceived as part of the copenhagen document back in and has played a strong role in supporting,20
sp sp sp the reviews the report in a closed meeting and then forwards recommendations to the chief of police,20
sp sp sp sp sp sp sp sp sp sp investigation and submits that report to the police accountability board,20
sp at all times the chief of police retains both the responsibility and the discretion to make any disciplinary decisions,20
sp sp sp sp sp sp the chief of police makes the ultimate decision about the conclusion of the process,20
sp sp sp sp sp sp sp sp sp sp sp to learn more please visit our website at there,20
the conclusion of the process however that individual receive the specific disciplinary outcome if any of the investigation to,19
sp us but people around the world and think a great moment in the history of this planet basically,19
sp sp sp sp sp sp sp sp sp sp sp sp sp for the complete article please go to,20
of fame demonstrating the sp continued commitment to sp advancement and showcasing its programs and policies that benefit working parents,20
sp sp i love sp writing and if sp let's me sp be an opportunity to move to new york,20
also did supplemental magazines and now sp working on doing innovative library books and online products for librarians at scholastic,20
sp sp and then another friend of mine from the workshop at columbia's recommended me for the job at scholastic,20
into writing by taking this extraordinary workshop with a teacher editor and well known professor at columbia's named gordon lish,20
was an opportunity at golden books and would i like to go there and be a part time assistant editor,20
following that i took time and had the most glorious experience of my life which was to have our daughter,20
wrote sp books for their licensed characters like chip the teacup and frosty the snowman and those types of books,20
jim henson workshops and i worked with the muppets on the muppets take manhattan as one of the background puppeteers,20
sp sp sp sp sp sp sp so she said why you partner with people in the theatre department,19
also did supplemental magazines and now sp working on doing innovative library books and online products for librarians at scholastic,20
stuff to new york at my own expense i could work for them and tour the schools with their company,20
it gave me the confidence to write all of the puppeteer companies that were listed in the new yorker magazine,20
act or acts of desperation by targeting baghdad as they are to sow fear after been largely forced out of,20
sp sp sp i also want to note the bravery of the iraqi security forces who responded to this attacks,20
them go further in their careers that is actually very beneficial to the country the bottom line of the country,20
are working to get the voice of those girls really heard so sp happy that we can play a role,20
to listen to them to really craft a message that will get people to help them and further their ideas,20
are working to get the voice of those girls really heard so sp happy that we can play a role,20
company changed its name from silver and at the close of business february voluntarily de listed from the venture exchange,20
listings on the canadian securities exchange formerly known as the canadian national stock exchange and is trading under the symbol,20
the on the fly voice translator mobile application that recognizes speech and text and translates into more than supported languages,20
on the acquisition development and marketing of software applications for mobile computing devices including smart phones tablets and wearable computers,20
apps and has an established and growing user base which currently generates consistent monthly cash flow from the to daily,20
app is available for and and can be purchased on and the apple app store for and is available at,20
sp sp sp this latest acquisition grows our install base substantially and will greatly contribute to the sp monthly cashflow,20
paul president stated continues to execute its business model of acquiring apps that will generate significant returns for the company,20
website at this video is for information purposes only and it not a recommendation to buy or sell any securities,20
sessions you get such a breadth of science that you really can build and tap into that really expansive knowledge,20
as well as not staying too long in a specific area or not being too brief in a specific area,20
sp sp sp and are you making adequate eye contact with the entire crowd for an appropriate length of time,20
sp sp sp sp so if sp done a video tape pay attention to what doing with your body,19
sp sp sp sp sp sp leading questions help the client to admit to information that otherwise might be withheld,20
sp sp sp sp sp sp now yes or no questions helped the interviewer to establish clarity on details discussed,20
sp sp sp sp in this example the client was reluctant to admit that her ex stole from her leading,20
also help a client to articulate ideas that they cannot express those ideas or do not see them as relevant,20
sp sp asking narrow questions has the benefit of letting the interviewer focus on specific topics to elicit required details,20
sp sp sp however leading questions suggest an answer and have the potential to decrease the accuracy of the answer,20
made by new interviewers is asking too many narrow questions and the question elicits only the information the interviewer needs,20
please take a few moments to learn more about the brochures and sample packs that are also available to you,20
sp sp sp sp sp sp again my name is david kent and i hope you have a great day,20
encourage you to place this display either at your check in or checkout counter or right inside the treatment room,20
sp sp sp sp sp sp again my name is david kent and i hope you have a great day,20
sp sp sp sp sp sp sp sp sp sp sp sp sp sp talk to your audience that way,20
sp sp sp sp sp sp sp sp sp sp sp sp sp sp talk to your audience that way,20
sp sp sp sp sp well worthwhile because it could help our planet it could help our future generations,19
sp sp sp sp sp sp sp sp sp sp sp sp sp robert todd and thank you for watching,20
sp sp for instance one may not conclude that because stealing is morally and legally prohibited it does not happen,20
sp sp sp the realm of what actually is and the realm of what ought to be are logically disconnected,20
sp conversely it cannot be concluded either that because stealing does occur in practice it is morally or legally acceptable,20
clearer and the more enforceable the ethical or legal norm the greater the gravitational attraction it may exert over reality,20
also seems to think that someone who goes to a school and kills children already has a previous criminal record,20
sp sp sp sp sp in fact if they did that would actually help society to pinpoint potential mass shooters,20
the bait when the commentator asked him to explain what he meant by new york values and instantly enraged million,20
product until sp been paid will minimize the likelihood that going to get paid late by any individual client,19
of most businesses existence especially those that deal with people who provide services and then pay at a later date,20
sp sp sp sp sp sp sp sp dealing with late paying clients is the bane of every sp existence,20
the accounting department with a copy of the invoice and your letting them know that you anticipate being paid soon,20
product until sp been paid will minimize the likelihood that going to get paid late by any individual client,19
sp sp sp sp sp also provide them with the contact information for the person who originally secured your services,20
sp sp sp sp sp sp sp sp sp sp sp sp sp they have been underestimated than and of,20
as its very essential that what prescribed should be implemented as soon as possible to the central universities as unfortunately,20
sp sp sp sp sp sp sp sp sp sp sp sp sp sp sp is matthew perry speaker narrator,20
sp sp sp sp sp sp sp sp sp sp sp sp sp sp perry sp his name i think,20
matthew perry the guy's from ferris day off i think his name is matthew perry sp pretty sure speaker,19
sp sp sp narrator line uhh speaker narrator line matthew perry speaker narrator line i think his sp matthew perry,20
a hero in a movie speaker narrator line umm he sp very good speaker narrator line umm at you know,20
sp sp sp sp sp sp sp sp sp sp sp sp narrator line umm speaker narrator line yeah speaker,20
look nearly as good as jurassic park speaker narrator line umm it actually looked kind of similar it looks,19
or anything like that speaker narrator line umm the effects in this movie were not that great this was actually,20
sp be reviewing the godzilla speaker narrator line now this movie speaker narrator line well speaker narrator line if you,20
sp sp sp sp line hey sp sp it going my name is jordan and uhh today sp gonna be,20
sp sp sp sp sp sp sp sp sp need to watch any more of this review umm speaker narrator,20
sp sp sp sp sp sp sp sp sp sp sp sp saw it speaker narrator line then you probably,20
sp sp sp sp sp sp sp sp sp sp sp sp of speaks for itself speaker narrator line uhh,20
sp sp sp sp sp sp sp sp sp sp umm speaker narrator line the movie kind of speaks for,20
sp sp sp sp sp sp sp sp sp sp sp sp sp sp movie matthew perry speaker narrator line,20
sp sp sp sp sp sp sp sp sp sp sp sp sp sp sp sp not really a,19
sp sp sp sp sp sp sp sp sp sp sp sp sp sp sp sp not matthew perry sp,20
sp sp sp sp sp sp sp sp sp sp sp sp sp sp sp narrator line is actually not,20
sp sp sp sp sp sp sp sp sp sp sp sp sp sp sp finds a uhh i sp,20
sp sp sp sp sp sp sp sp sp sp sp sp sp the movie boxing helena a psychological,19
sp sp sp sp sp sp sp sp sp sp sp line hi my name is and today sp reviewing,20
sp sp sp sp sp sp sp sp about this doctor sp kind of uhh crazy sp really generous you,20
sp sp sp sp sp sp sp sp thriller if you sp watched it a nice movie about,18
girl sp kind of a and uhh well the sp r rated it has some uhh adult scenes in it,20
sp sp sp sp sp sp sp sp sp sp sp sp sp sp sp you know really rich but,20
of the guy's uhh julian sands and fenn so the acting was just alright uhh a onetime movie definitely not,20
sp sp sp sp sp sp sp sp sp sp sp sp sp sp with them and uhh an,19
sp sp sp sp sp sp sp sp woman the woman is you not interested in the guy's so he,20
sp sp sp sp movie definitely not my type though it it stutter is a thriller he wants this woman,20
sp sp sp sp sp sp sp sp sp sp sp sp sp sp sp so that is about it,20
sp sp sp sp sp sp level i know you gotta that first i gotta count the p switch,19
sp sp sp sp sp sp sp sp sp sp going to be pretty familiar with the level i know,20
think we need him can just use this guy's okay this is where look at a piece switches man okay,20
sp sp sp sp sp sp sp coming to nau after leaving the reservation was a big step for me,20
of friends here and met a lot of great people and close friends i plan to know throughout my lifetime,20
just the forestry world but sp really and enjoyed it and am comfortable here at the school of forestry,19
sp my name is melvin hunter sp a senior at nau school of forestry with an emphasis in fire ecology,20
sp sp sp sp sp sp sp fuels prescription writing and treating the forest really to prevent these catastrophic fires,20
of forestry i heard about the hooper sustainability award which is a grant for either research study or community sustainability,20
sp sp sp sp sp sp help the landscape either progresses in this shift or somehow mimic a historical regime,20
be taught to the troubled youth but specifically the wildlife fire department to help with to using a compass paces,20
sp sp greed has poisoned souls has barricaded the world with hate has goose stepped us into misery and bloodshed,20
sp sp sp sp sp the way of life can be free and beautiful but we have lost the way,20
sp sp sp sp sp sp sp sp without these qualities life will be violent and all will be lost,20
sp sp sp sp sp sp sp sp sp sp sp sp sp sp sp sp sp sp thank you,20
as i know harry is the only one beaten mercedes benz in the state of indiana on lemon law suite,20
a number of reduced offers he brought them to the table at the full amount and wired me the money,20
sp sp sp i had been asked to speak to you on behalf of my friends at krohn and moss,20
sp sp sp sp sp sp sp it was one of about fourteen i had bought from them in years,20
sp sp sp sp sp i bought an from a dealer in mishawaka indiana by the name of gurley leep,20
guy's is a terrific and if you a get a problem with car they are the people to talk to,20
guy's is a terrific and if you a get a problem with car they are the people to talk to,20
was a lot of expensive instruction in business ethics at business schools and that make businessmen any more honest,19
sp sp sp sp sp sp sp sp i remember the last time there was a round of corporate chicanery,20
was a lot of expensive instruction in business ethics at business schools and that make businessmen any more honest,19
way ok bring in things that are your own opinions you know make sure that you know is a,19
out of my experience that this includes responsibilities and tasks that i am good at and i like doing and,20
i am julian and by working with junge marke i want to make the world more suitable for young people,20
great at their honorary work and i am confident and sp be happy to do so for the as well,20
sp sp like doing and also because i during the last weeks that this challenge is truly inspiring me during,20
waited for this challenge or it waited for me but it seems kind of like it was made for me,20
sp sp sp sp sp sp sp sp sp sp sp sp sp sp sp sp this topical humor like,20
sp sp sp sp sp sp sp sp sp sp sp sp sp sp all trying to make this topical,20
sp sp sp sp sp sp sp sp sp sp sp sp sp sp spears just all this ridiculous stuff,20
sp sp sp sp me danny ericson and sp here to talk to you today about the movie currently,19
sp sp sp sp sp sp sp sp sp sp sp sp sp sp sp line hello land me,19
to this movie cause i knew i would hate it cause i hate all movies like this like exactly what,20
sp sp sp currently in theaters meet the and i know stutter why i did but i went to,19
sp sp sp sp sp sp sp sp sp sp sp sp sp sp they made things like the comebacks,20
sp sp sp sp sp sp sp sp sp exactly what the scary movies have become the last three hundred,20
sp sp sp sp sp lame attempts that just keep on referencing movies over and over and sp just not,20
sp sp sp sp sp sp sp sp sp sp sp sp things like the comebacks sp just all these,20
about the three hundred and really they just keep on bringing up things that sp funny sp all trying to,20
have i just know how they come up with them sp not funny meet the was just the same,19
sp but we need to be more on the capital market side which we will with a national securities regulator,20
sp sp sp sp sp if he says how come you see niggers the way i see them you,19
people is to let's them be what they are unless they say i seem to get along with sp,19
sp sp sp sp sp sp sp sp sp sp sp sp sp it always occur but it will,19
sp sp sp sp sp sp sp sp sp sp sp sp sp sp sp very few people do that,20
sp people in fact sp never run into a person that said what do you think of my value system,20
sp sp sp if they do that and sincere not an ego thing where they appear to be polite,19
sp sp sp sp sp sp sp sp sp sp sp what do you think of the way i think,20
sp sp sp sp sp sp i mean if you want to be racist ok sp not interested in that,20
sp sp sp sp if a person annoys you in some way just say i like to discuss races,19
sure that we bring the public in as the team and treat them as a resource not as a liability,20
to a lot of people from an international perspective but also from the standpoint of how technology builds that team,20
sp sp sp sp sp sp and for today probably one of the most inspirational speakers we have ever had,20
is very negative as indeed would be tariffs on britain because after all britain is the sp original trading nation,20
sp sp sp sp sp sp sp sp sp sp sp remember great britain is less than percent of world,20
the european union that much outside of britain and i think it has got negligible impacts on the united states,20
realized yes this is a big splash for britain but a small ripple for the rest of the world,19
sp sp sp sp sp sp but they were shocked and so you had shock and disappointment the day after,20
realized yes this is a big splash for britain but a small ripple for the rest of the world,19
have expected i think they should have expected that this would be an easy win for the remain campaign,19
sp sp from a political perspective sp got disarray in the conservative party in britain and in the labor party,20
to the united kingdom is far more damaging than sp going to actually happen for the rest of the world,20
forward if that means it can be part of the european union which it would now get pulled out of,20
that will want to follow sp lead because i think what britain is doing to itself will be pretty damaging,20
terms of political implications for the united states or for india or for china i think those are pretty minor,20
realized yes this is a big splash for britain but a small ripple for the rest of the world,19
so when people know sp going to happen with a big issue like this markets tend to sell off,19
sp sp sp sp sp sp sp sp sp sp sp sp sp sp sp sp sp sp sp movies,20
sp sp sp sp sp sp sp sp sp movies that you know that some of the other older movies,20
sp sp sp sp sp line hi my roger and i want to tell you about a movie called body,20
sp sp sp sp sp sp sp sp sp sp sp sp sp sp sp sp sp sp line hi,20
a mystery intrigue umm speaker narrator line you know very very kind of uhh stutter drama type uhh you know,20
brian de palma movie that came out back in nineteen eighty four speaker narrator line and i will tell you,20
sp sp sp sp sp sp sp sp sp sp sp sp sp type movie speaker narrator line and umm,20
sp sp sp sp sp sp sp sp sp type uhh you know speaker narrator line investigative type movie speaker,20
to figure out how this happened speaker narrator line umm but you know speaker narrator line getting this movie a,20
was a good movie about a guy's who was house sitting and actually seeing somebody's get murdered and all of,20
i saw it again and i just i just stutter enjoy it like i would of some of movies,19
and looked at it and i said you know kind of stutter just not up to par,17
here that means there will be a new batch of state officers ready to come and take the reins watch,20
sp sp sp sp sp sp sp sp sp sp sp sp sp hey congress is almost here that means,20
sp sp sp sp not that running but there will be campaign booths question and answer and skits and speeches,20
sp sp sp sp sp sp sp sp watch out for the state officers that are going to be running,20
sp sp sp sp sp sp sp sp sp going to be huge congress will be here july through,19
sp sp sp sp sp sp sp sp sp sp sp sp sp sp sp going to build a clover,20
sp sp sp sp sp sp sp sp drama queen is used especially for a woman who is extremely melodramatic,20
sp sp sp sp sp sp sp sp sp sp sp sp very first one we have is drama queen,20
sp sp sp sp sp sp sp sp sp sp like for example a friend of mine lost her wallet,20
situation or for an event the way this woman would react will be in a very exaggerated and melodramatic way,20
sp sp sp sp sp sp sp sp and this another friend of mine was like oh no really oh,20
sp sp sp sp sp sp sp sp sp sp sp sp right so she is such a drama queen,20
sp sp sp sp sp sp sp sp sp sp sp sp now quite and exaggerated reaction right so,19
sp sp sp sp sp sp sp sp sp sp for him or will a simple simple stutter window shade,20
sp sp sp sp sp sp sp sp sp sp sp sp stutter window shade be enough speaker narrator line,20
sp sp sp sp sp do the best job acting in this at all speaker narrator line umm basically,19
sp sp sp sp sp sp sp sp sp sp sp sp sp sp sp basically you have frank who,20
sp sp sp sp sp sp sp sp sp is stopping a terrorist plot that could mean curtains for him,20
sp sp sp sp sp sp sp sp sp sp sp sp sp sp sp sp hi expo this is,20
sp sp sp sp sp sp sp sp sp sp sp sp sp sp sp sp sp line hi expo,20
sp sp sp sp sp sp sp sp sp sp sp sp sp three two one to see what i,20
sp sp sp sp sp this is melissa you can check out my profile and my reviews at pm three,20
sp sp sp sp sp sp sp sp sp sp sp sp sp sp line we are talking about today,20
sp sp sp sp what i have been talking about lately excuse me speaker narrator line we are talking about,20
sp sp sp sp sp sp sp sp sp sp sp sp sp sp and a half the final insult,20
sp sp sp sp sp sp sp sp sp sp sp sp sp sp sp sp sp sp naked gun,20
sp sp sp sp sp sp agree this is horrible it is a final insult umm the first two movies,20
sp sp sp sp sp sp sp sp sp sp sp sp sp sp sp insult and i agree this,20
sp sp sp sp sp sp sp sp sp sp sp sp sp sp sp sp hated this one i,20
sp sp sp sp sp sp sp sp sp sp sp sp sp sp sp sp two movies i hated,20
sp sp sp sp sp i hated even worse so my husband and i were just joking around that if,20
sp sp sp sp there was an option on expo i would click a zero out of five but sp,20
sp sp sp sp sp sp sp sp sp sp sp sp sp sp sp sp if there was an,20
sp sp sp sp sp sp sp sp sp sp sp one out of five that bad umm created,19
sp sp sp sp sp five but sp not so i had to go with one out of five,19
over and over again they must be so excited that sp given them her presence but she do the,19
sp sp sp sp sp sp sp sp sp sp sp sp sp created by the zucker brothers we have,20
can stand up for their rights and fight against this discrimination then hopefully one day we will be treated equally,20
sp sp so annuities are very common although a lot of people know that sp actually working out there,19
sp sp sp sp sp sp sp sp sp sp this is financial adviser patrick munro telling you about annuities,20
sp sp sp sp sp sp sp sp sp sp this is financial adviser patrick munro telling you about annuities,20
accumulate a large amount of money and when they retire that money becomes available in a monthly check to them,20
sp sp sp sp sp sp sp sp sp sp sp sp sp for the complete article please go to,20
the negative is so that your energy system is tuned in to the issue that you want to deal with,20
sp so on the negative while you tap is good but focus on the negative while not tapping,18
accept that i accept myself right you just weave it in as yet more of a set up statement,19
the tapping on points heal you to a point where those emotions come out naturally of self acceptance forgiveness peace,20
sp sp sp sp i look forward to speaking with you again on another one of these advanced approaches videos,20
sp sp sp sp sp sp you can use all sorts of endings on that whatever you are comfortable with,20
saying that negative stuff but when we get to the deeply and completely accept you go oh no i,19
sp i believe that at all so what can you say when you deeply and completely accept yourself,18
that fight with my spouse feeling upset about that fight with my spouse just focus on what the issue is,20
works just as well if you say deeply and completely accept and if you just focus on the issue,19
sp sp sp sp i look forward to speaking with you again on another one of these advanced approaches videos,20
sp sp sp sp sp sp sp sp sp sp is not about trying to force yourself to think positively,20
this case this happens at and since the denominator of the left hand side of the inequality is zero there,20
sides are equal in this case and but also find x values where the functions involved are not defined or,20
sp sp sp sp sp on each interval either the inequality holds for all points or for none of them,20
sp sp sp sp sp sp sp sp sp these four points then divide the real line into five intervals,20
sp sp sp sp you can simply check at one point in each interval whether the inequality holds or not,20
sp sp sp the solutions to this inequality lie in the intervals where the blue graph is above green one,20
sp since we have a graph it is even easier to tell where the inequality holds at the intervals and,20
sp since we have a graph it is even easier to tell where the inequality holds at the intervals and,20
really matters here you see that at these points the inequality holds on one side but not on the other,20
sp sp sp sp sp sp sp sometimes sketching the graph is not an option because it is too difficult,20
sp sp sp sp sp sp sp sp stop just keep on writing until god's takes a break sr,19
sp sp sp sp sp sp sp sp sp sp sp sp sp sp sp it started a new beginning,20
sp sp sp sp sp sp sp sp sp sp when this child was born it shifted the atmosphere it,20
expounding in the pulpit he has a different demeanor and sp firm and sp assured about what sp doing to,20
sp to be able to expound on the word take knowledge and it takes sp spirit dwelling within that person,20
sp sp sp sp sp sp sp sp everything that god's says you just gotta keep on writing stop,19
machine and uhh a python engineered the perfect killing machine the sp first massive genetically enhanced and the actors,19
umm the python the movie the python and uhh a story about umm a doctor really like a mad,19
sp sp sp sp sp sp sp sp sp sp sp sp sp sp sp sp sp mccarthy will wheaton,20
sp sp sp sp sp sp sp sp sp sp sp sp sp sp sp sp sp uhh jerry mccarthy,20
sp sp sp sp sp sp sp sp sp sp sp sp sp sp sp sp sp sp casper stutter,20
sp sp sp sp sp sp sp sp sp sp sp sp sp sp sp sp sp sp uhh sp,20
