Sentence,totalwords
an easy task but then something good and sp sure all of us here in india are to go,19
sp sp sp sp sp sp and very clearly we have many weaknesses as well which need to work out,20
sp sp sp sp sp sp the student is the only member on the committee from the rio grande valley,20
sp sp sp sp sp sp the student is the only member on the committee from the rio grande valley,20
sp sp sp sp sp sp sp sp sp well to answer that we have to do some statistical inference,20
sp sp sp sp sp sp or is this something just an artifact of our data just statistical noise,19
sp sp sp sp sp now in here in these brackets we see the number of observations in each group,20
sp effect so sp going to have to do the confidence interval for that and that sp drawn right here,20
we might be worried that this number here is just statistical noise and is not an actual effect so sp,20
sp sp sp sp sp sp sp sp sp sp sp sp sp got our average treatment effect estimate of,20
sp sp sp sp sp sp sp sp sp sp sp error and this number here from the table,19
this guy's named nick persons who has just married the woman of his dreams suzanne umm he wants to settle,20
be reviewing a movie that i recently saw in theaters and called are we done yet and umm this,19
bustle of you know the city life and and you know to open up space for his new wife and,20
sp sp sp sp sp sp settle down so buys a quiet suburban house to escape you know the hustle,20
sp sp sp sp sp sp sp is that umm his house actually becomes very very expensive to fix up,20
sp sp sp sp sp sp sp sp sp sp sp lindsay and kevin but sadly what happens is that,20
sp sp sp sp contractor just a barrel of laughs umm an hour and thirty two minutes long,18
sp sp sp sp sp sp fix up and he has to deal with this like really weird crazy contractor,20
sp sp sp sp sp sp sp sp sp so come on sp show you how to get it done,20
you all the information you need to make a great speech sp very short sp very sweet sp very simple,20
sp sp sp sp sp sp sp sp sp sp sp sp though larceny is already on the list and,20
sp sp sp felony like can my three wives and i still vote in the state of mississippi like these,20
sp sp sp sp sp sp sp sp sp sp sp sp sp like is three not a felony like,20
sp sp sp sp sp sp sp sp sp sp sp sp sp and what does all this mean news,20
sp sp sp sp sp sp sp sp sp mississippi like these are questions i should not need to ask,20
recently reported that one in eight voting age black men are ineligible to vote because of outstanding convictions and this,20
sp sp sp sp sp the move was made to grow its financial restructuring turnaround management and bankruptcy reorganization capabilities,20
sp sp sp sp sp sp sp deloitte recently announced it had acquired substantially all of the assets of partners,20
sp sp sp sp sp sp sp sp sp sp sp sp sp for the complete article please go to,20
sp sp sp sp sp sp sp sp sp sp sp sp sp check out our party and platform at,20
sp sp sp sp sp sp sp sp next question is from a grade student at secondary school in hamilton,20
sp sp sp the socialist party of ontario truly believes that it is never too late to write the future,20
sp sp sp sp sp sp several other cities across the world have already adapted the three free zone initiative,20
would open cities and get people out of their cars thus reducing the impact of fossil fuels on the environment,20
sp sp sp sp sp sp sp sp sp there is no reason why we sp implement this in ontario,20
sp sp sp sp ask your parents if your future education is worth the gamble to save on tax dollars,20
sp sp sp sp sp sp sp sp sp sp sp sp sp robert todd and thank you for watching,20
sp sp sp sp sp sp sp sp sp sp many times these corporate kits include sample articles of incorporation,20
sp sp sp sp sp sp and going to have to decide in which state you wish to incorporate,19
sp sp sp sp sp sp duff as you can see on this dudes back uhh basically the best,19
sp sp sp sp line this is dustin with a video review of a cinderella story starring hilary duff as,20
umm not good at uhh stutter they try to the story of the classic fairy uhh into a,18
sp sp sp sp sp sp sp sp sp sp part of this movie is that it does feature hilary,20
sp sp sp sp sp sp sp sp sp sp sp sp sp sp sp and basically this girl she,20
sp sp sp sp sp sp sp sp sp sp sp sp sp sp sp modern day la type story,20
sp sp sp sp sp sp sp sp sp sp sp sp sp all this and stuff she has an,20
sp sp sp sp sp sp sp sp sp sp sp sp sp girl she works like manual labor and,20
sp sp sp sp sp sp sp sp sp sp and he ends up asking her to go to the,20
sp sp sp sp sp sp sp sp sp sp sp sp sp sp she has an email buddy and,20
sp sp sp sp sp sp sp sp sp sp sp sp filly who was sitting on a green cushion,20
her eyes widened in confusion and amusement she slowly lowered her gaze and stared at the lone yellow filly who,20
sp sp sp sp sp sp sp sp sp sp sp sp sp cushion what is it young one is,20
let's her mind reel back to her tribes temple a lion and a snake like creature riding it is the,20
sp sp sp sp sp sp sp sp sp sp sp sp it seemed this creature was riding the lion,20
sp sp sp sp sp sp sp sp sp sp sp sp sp true is this really the god's cord,20
sp sp sp sp sp sp sp sp sp in the lion collapsed letting out soft moans of i yield,20
creature grabbed a rope and it around the sp the lion growled but its old shaky legs gave in the,20
sp sp sp sp sp sp sp sp sp sp sp sp sp just stood their her mouth gaping discord,20
will be speaking about this new approach in a speech today at the george washington program on countering violent extremism,20
partners to advance all five of these strategic objectives using the full range of diplomatic development and foreign assistance tools,20
sp sp sp sp actors completely acting out of char character excuse me but it worked perfectly for that scene,20
sp so again to stress you cannot get too much coverage because it will really save your neck later on,20
sp sp sp sp sp sp sp sp sp sp sp rieger white caspian studios on behalf of expert village,20
things that must be taken care of must be taken care of on a movie shoot are coverage and continuity,20
go without saying that the director has to make sure that everything gets taken care of on a movie set,20
sp so again to stress you cannot get too much coverage because it will really save your neck later on,20
sp sp sp you can almost not get too much coverage but you can very easily not get enough coverage,20
sp sp sp so sp living witness that nixon came into office uh thinking about uh reestablishing relations with china,20
sp sp sp so sp living witness that nixon came into office uh thinking about uh reestablishing relations with china,20
i uh don and i went into the oval office just the three of us the president don and myself,20
can order a product and i have to pay until thirty days after that product is shipped to me,19
sp sp sp sp sp sp sp sp sp sp cod sp mike campbell with doggie styles in beverly hills,20
that product so i have to buy a large quantity to start out and take a risk on that,19
so by the time i have to pay the vendor off and that allows me to buy more of it,20
a lot of times with a new business starting out going to be payment in advance or at least,19
sp sp sp sp sp sp sp sp sp sp sp mike campbell with doggie styles from beverly hills california,20
sp sp sp sp sp sp sp sp in over forty three billion dollars were spent in the pet industry,20
attend meet a multitude of vendors in that industry and find out all of the different products that are available,20
so you want to be able to find wholesalers who have all the different types of products that you need,20
sp sp sp sp sp sp sp sp sp sp cod sp mike campbell with doggie styles in beverly hills,20
calendar just full of appointments with different vendors who want to come in and show me their new products,19
sp sp sp sp sp sp sp sp sp sp sp sp sp so forget breathe smile and focus,19
sp sp sp sp sp and they give their whole speech like this and they are terrified the whole time,20
sp sp sp sp sp sp sp sp sp sp sp sp sp so forget breathe smile and focus,19
to cook and she loved to quilt and all the sudden the daughter takes up cooking and quilting yeah does,20
that make any sense and simplicity is the mom is in the daughter space the daughters in the mom space,20
when i said that or why did i do that or this is an unusual behavior for me to express,20
sp sp sp sp it was too cheesy for me you umm it was actually expected to be kind of,20
sp sp sp sp sp sp sp sp sp sp sp most part you know it was again it was,20
sp sp sp sp sp sp sp sp sp sp i really sp recommend this this stutter movie to umm,20
sp sp sp sp sp sp sp sp sp sp sp sp to be kind of corny so i really,20
sp sp sp sp sp sp sp sp sp sp sp sp sp sp sp sp josie and the uhh,20
sp sp sp sp sp line hello my name is sarah and i will be doing the video review for,20
sp sp sp sp sp sp sp sp sp sp sp this movie at umm i felt it was kinda,20
sp sp sp sp sp sp sp sp sp sp sp sp sp sp basically i really did not like,20
sp even met so you know to recommend this movie you know i really umm i i stutter found one,20
sp sp sp sp sp sp sp sp sp sp sp sp sp sp kinda umm of course i had,20
sp sp sp sp sp sp sp sp sp sp sp sp sp record companies put uhh subliminal messages in,20
sp sp sp sp sp sp thing about this movie that i thought was kind of interesting umm these record,20
sp sp sp sp to buy certain umm that part of the movie was pretty cool umm for the most,20
sp sp sp sp sp sp sp sp sp sp sp sp sp sp sp in music to push products,20
sp sp sp sp sp sp sp sp sp sp sp sp sp for the complete article please go to,20
sp sp sp sp sp sp sp sp from sp never been a debate why are you refusing to debate,20
tackle the issues at great concern the public knows who will deal best with the security regional and economic challenges,20
sp sp sp sp sp sp sp sp sp whoever wants to strengthen me should grant their vote to my,20
offering are small incremental improvements then your clients are going to expect to pay small dollars for them but,19
sp sp sp sp sp sp sp sp sp sp sp sp sp fight your desire to tell everything when,20
help and guidance from me and my team of curators sp be very very happy to to help you all,20
in art series a series that we put together to give people help and guidance about investing in emerging art,20
name is rebecca wilson and sp the chief curator at saatchi art and the director of our art advisory service,20
artists artists who sp known but actually went on to become some of the giants of the modern art scene,20
who lived in a small apartment in new york and have much money but shared a passion for art,19
amassed an extraordinary collection of over works which they donated in the to the national gallery of art in washington,20
sp sp sp sp sp sp sp sp sp sp names such as donald judd roy lichtenstein and chuck close,20
big budgets in order to start a collection and buying works by emerging artists is a great way to begin,20
are works by very very talented artists from around the world whose works have the potential to rise in value,20
hope you will look at the works that sp selected by emerging artists for our ongoing invest in art series,20
sp sp sp sp sp sp sp sp sp sp sp the united states congress is currently debating immigration reform,20
from mexico to the united states was about the same as the number moving from the united states to mexico,20
sp sp half as many children which helps to explain why immigration from latin america has been dropping for years,20
sp sp sp sp sp sp sp you can see the birth rates fall to us levels and sometimes below,20
sp sp sp sp sp sp latin america now has a workforce that is growing at a slower pace at,20
sp sp sp sp sp sp at the same time you can watch the per capita of these countries triple,20
sp sp sp sp sp sp sp sp sp when the us economy recovers large scale latino immigration will not,20
sp sp sp sp sp sp sp sp sp at the same time this work force has many new opportunities,20
sp sp sp sp sp sp sp nobody in washington democrat or republican is willing to acknowledge the simple fact,20
sp sp sp sp sp sp sp sp the people necessary to restart the immigration boom are simply not there,20
sp sp sp sp sp sp sp sp sp sp sp sp sp they used called the umm it the,20
sp sp sp sp sp world now one thing i thought was pretty cool about this movie was the technology,20
sp sp sp sp sp sp sp sp sp sp sp and you never expect it until they actually pull,20
the characters to make an exact copy of sp face and then sneak in somewhere and then pull it off,20
sp sp sp kind of a fun soundtrack it was real popular at the time had some of the more,20
sp they actually pull it off it looks really weird umm but the actual movie has kind of a fun,20
sp sp sp sp sp sp sp sp sp sp some of the more popular bands it was really trying,20
sp sp sp sp sp sp sp sp line hi sp here to give you a video review of a,20
sp sp sp sp sp sp sp sp sp sp sp sp sp sp sp sp sp sp line hi,20
sp sp sp sp sp sp sp sp sp sp sp impossible two starring tom now i sp stutter honestly,20
sp sp sp sp sp sp sp sp sp sp sp sp sp sp sp sp sp terrible movie mission,20
sp sp sp sp sp sp sp sp sp sp series has been somewhat lacking the first one had a,20
sp sp sp sp sp sp sp sp sp sp sp sp sp honestly found the entire mission impossible movie,20
sp sp sp sp sp sp one is a hundred and twenty three minutes long so pretty long and,19
the best out of all three the third one was just terrible not even worth mentioning this one is a,20
sp sp sp sp sp sp sp sp sp sp sp sp sp sp sp sp sp from attacking the,20
sp sp sp sp sp sp it follows tom character as he tries to stop the deadly chimera virus from,20
most states and in most provinces a physician referral is not required so you could also go direct to the,20
sp sp another sign is that you need to request repetition more frequently than others particularly in back ground noise,20
sp sp sp sp sp sp sp sp sp sp sp you have life and liberty without basic health care,20
sp sp sp sp this is financial advisor patrick munro talking about why we should invest in certificates of deposit,20
sp sp sp sp this is financial advisor patrick munro talking about why we should invest in certificates of deposit,20
sp sp sp sp sp moving up we move into a bigger world of risk perhaps mutual funds and stocks,20
saying something more i think like sp been wanting us to get together sp been wanting us to meet together,20
sp in the causative form as we discussed in the causative lesson you use to at all you can,19
more of a mutual idea the idea that is there is activity going on on both sides of the interaction,20
sp sp sp sp sp sp sp sp sp sp sp all you can only use either wo or and,20
sp sp sp sp sp sp either making someone do something or allowing them to do it if,18
sp well because when you do a causative action you are very much in control of the action,18
just sitting there not being used unless something bad happens and we need to do a forensic look at it,20
sp sp the thing that excites me the most about the future is the use of data that sp gathering,20
business intelligence systems and they can be data mined and be used for operational improvement instead of just forensic investigation,20
you get to that your roi stars to improve on your system security spend and what all about,18
or maybe you give that attorney's for a little less money a couple of points or ownership in the film,20
pretty much ready to go to the next step which we will reveal on expert village in our next segment,20
sp but our next topic here is what is the next step that you take for a first time producer,20
sp sp sp sp sp sp star wondering what on earth is this crazy woman talking about let's me,19
sp sp sp sp just really good i know can i tell you why sp addicted i have,18
sp sp sp sp sp sp sp sp sp sp sp sp i just binge watch non stop so,19
sp sp sp sp sp sp sp and so romantic and adorable and funny and sp always tempted why,19
sp so i walk past she looks like sp having so much fun and sp so pretty so good looking,20
sp sp sp sp sp sp sp sp sp sp sp sp i cause sp be tempted to learn korean,20
sp sp sp sp sp sp sp sp sp sp sp sp sp sp sp so i resisted and resisted,20
sp sp sp sp sp sp sp sp sp sp sp sp and i want to fix my japanese first,20
sp sp sp sp and now sp addicted to watching potato star what the hell is a potato star,19
allows students to pay back their student loans that they had to take out for degree completion to begin with,20
sp sp sp sp sp this is a definition of success that the media often is telling to students but,20
sp sp sp sp sp sp sp it included being holistic academic components personal components life skills competencies you know,20
through the use of your car lights your hazard lights flashlights or beacons that you might carry with you separately,20
you need it to be to get attention so they can begin a rescue or to get you some help,20
you need it to be to get attention so they can begin a rescue or to get you some help,20
sp sp sp sp sp sp sp sp because what happens then is it starts to sound a bit wrote,20
sp sp sp sp sp sp sp sp sp sp sp sp sp sp sp sp sp keep it spontaneous,20
sp sp sp sp sp sp sp sp sp sp sp sp sp sp sp sp sp keep it spontaneous,20
on line advertising and media works but learning now about you know what types of approaches work better than others,20
sp sp sp sp sp sp sp sp speak it kind of renews it and fills it with moisture and,20
quickly and is not oily at all makes my skin feel very hydrated and less thin so to speak it,20
day cream works great for me because well i have dry skin and i need a fair amount of moisture,20
sp sp sp sp sp sp sp sp sp and the skin just feels smooth and hydrated and silky and,20
sp sp sp sp sp sp sp it has both vitamin c and hyaluronic acid in it by the way,20
sp sp sp sp sp sp sp sp sp i put it on after the serum in the morning it,20
the day which is important for me because i have to worry about my skin until the evening treatment,19
sp sp sp sp sp so it kind of finishes of the facial treatment and it boosts the moisture up,20
would like to firm your skin up or if you have a more dry type of skin like i have,20
sp sp sp sp sp sp sp sp sp sp sp sp sp sp sp i really enjoy these products,20
sp sp sp sp sp sp sp sp sp sp sp sp the first one is this hyaluronic acid serum,20
sp sp sp sp sp sp sp sp sp sp sp hi i am going to review cosmetics products the,20
sp sp sp sp sp sp sp sp sp sp sp sp serum the third one is the day cream,20
sp sp sp sp sp sp the second one is the c booster serum vitamin c booster serum the third,20
sp sp sp sp sp sp sp sp sp of my face and sp tried several which were ok and,20
face i notice how my pores just seem bigger than the pores in the other parts of my face and,20
used it twice daily it managed to even out my skin tone and make the pores seem less visible and,20
sp sp sp sp sp sp sp sp sp sp sp sp were ok and than sp encountered this serum,20
sp sp sp sp sp sp fast you put it on and your skin just drinks it up it is,20
and together with the day cream also radiant and it finishes of the treatment very nicely like sp said so,20
sp sp sp sp sp sp sp sp sp sp sp and it absorbs beautifully very fast you put it,20
sp sp sp this article really emphasizes the importance certainly from a narrative perspective of engaging conversations in our work,20
always say more traditionally inclined therapists using with their gay identified clients continually referring to this thing called internalized homophobia,20
of what could otherwise be described as a devastating tragedy so enjoy and i look forward to hearing your thoughts,20
of what could otherwise be described as a devastating tragedy so enjoy and i look forward to hearing your thoughts,20
article on called linking lives around shared themes written by chris behan which engages narrative practices in a group context,20
sp sp sp sp sp sp donald trump now represents the republican party whether they want him to or not,20
sp sp sp sp sp party get hijacked by the extremists who put donald trump up as their president donald,20
sp sp sp sp sp sp sp sp sp sp sp sp sp sp as the president sp the leader,20
so sp confident that as long as keep this on the agenda we sp lose out during this current crisis,20
so sp confident that as long as keep this on the agenda we sp lose out during this current crisis,20
sp sp sp sp sp sp sp sp sp sp sp sp begun offering products around insuring carbon capture methods,20
sp sp sp sp sp sp sp sp box and pointer notation helps us represent that closure property of lists,20
sp sp sp one per element and each box contains either a primitive value or points to a compound value,20
and then a nested list or hierarchical structure which contains as its first element another list with and in it,20
pointer diagram allow us to visualize this structure so pair is bound to a list containing and and are the,20
this one is an empty list and then the third element is a list which itself has lists within it,20
sp closure is the key to power in any means of combination because it permits us to create hierarchical structures,20
are made up of parts which themselves have parts and those have parts and those have parts and so on,20
i mean by hierarchical and important because that sp us represent things in the world that are also hierarchical,19
sp this final stage is called the venting stage and it happens just before you wake up in the morning,20
when you start keeping dream journal that going to be probably remembering a lot of these venting dreams,18
sp sp sp sp sp sp sp well sp here to tell you that that is actually a good sign,20
quite negative and it kind of distressed you because you woke up thinking now why did i have that dream,20
when you start keeping dream journal that going to be probably remembering a lot of these venting dreams,18
when releasing toxins from the physical body it really feels uncomfortable but once sp gone and it feels better,19
sp sp sp sp sp sp sp sp sp joanna crawford and crawford park financial is a hard money lender,20
sp sp sp sp sp sp sp we look forward to hearing from you and about your business purpose loans,20
sp sp sp sp sp sp sp we look forward to hearing from you and about your business purpose loans,20
sp sp sp sp sp tests include occupation property management property income use of loan funds and statement of purpose,20
people a second to try and explain why they sp following your directions or why they follow your directions,19
how it affects different groups of people across the economy specifically for new york state and also in the usa,20
sp sp sp sp sp sp sp sp why important to remember number two get into the conversation,18
sp sp sp sp sp sp sp sp sp sp sp sp sp but you be a passive participant,19
sp sp sp sp sp sp a concept they teach in traditional marketing and no different here with,18
sp sp sp sp sp sp sp you know the importance of word of mouth in growing your business,19
with social media word of mouth has gone global and critical that you start bringing yourself into the conversation,19
sp sp sp sp sp sp sp sp sp sp sp sp sp number three the law of fabulous if,20
sp sp she says here i am world love me leave me follow me me judge me sp fabulous her,20
sp dabney says when she stopped caring about who was judging her she was really able to step into her,20
sp sp sp sp sp sp sp sp sp sp sp sp sp this movie like the previous two rush,20
sp sp sp sp sp sp sp sp sp sp sp sp sp sp line hi today sp the movie,20
chan and chris this one actually takes place in paris umm sp after a chinese mastermind sp uhh lots of,20
sp sp sp sp sp sp sp sp sp sp sp sp sp two rush hour movies stars jackie chan,20
hour movies i really think they sp stopped at the first one in my opinion they kind of got progressively,20
sp sp sp sp sp of in this movie umm i did not find this rush hour to be as,20
sp sp sp sp sp sp sp after the first umm if you are just umm uhh diehard fan of,20
daily basis is to advise my clients on what to do in order to make the best possible business decision,20
dr art bowler and i am a psychologist in manhattan new york city where i have my own private practice,20
sp sp sp sp sp this is dr art bowler and this has been how to help a depressed person,20
you have a loved one who is depressed those are some of the things that you should think about doing,20
sp sp sp sp sp this is dr art bowler and this has been how to help a depressed person,20
sp sp sp sp sp sp sp sp sp sp sp so edit everything before you hit that send button,20
sp sp sp sp sp sp sp sp are you sending too much information have you gone on and on,20
be at home and have an irregular heart rhythm that would be captured by this portable monitor which sp wearing,20
rhythm the first step is actually to get a complete story of the patient and understand what the symptoms are,20
be at home and have an irregular heart rhythm that would be captured by this portable monitor which sp wearing,20
sp sp sp sp sp sp sp of course it was poor education for me about how to select land,20
sp sp sp sp sp sp sp sp sp sp sp sp sp sp i think a tribe is different,20
honest early on i was very disappointed in how the land claims that passed would have provisions for private corporations,20
sp sp sp sp sp not being well schooled in how to handle their finances would soon spend it up,20
sp sp sp and you know go into bankruptcy and to sell off and lose the land and so on,20
they have business corporations but they are all separate from the tribe and obviously set up to do the business,20
sp sp sp sp sp sp sp sp sp sp sp sp sp sp i think a tribe is different,20
sp sp sp sp sp it was the other half of trying to select lands that sp claimed by somebody's,20
sp sp sp sp sp sp sp sp sp sp sp sp sp sp sp not funny not,18
sp come true and go on a date okay all sp but all that matters uhh terrible,17
sp sp sp sp sp sp sp sp sp sp sp sp sp sp actually kind of sad i own,20
sp sp sp sp sp sp sp sp sp sp sp sp sp sp sp sp sp sp sp sp,20
sp sp sp sp sp sp sp sp sp sp sp sp sp sp sp sp sp sp rated,19
