Sentence,totalwords
wall and if we sp percent sure who you are and why coming to america not getting in,18
sp sp sp sp sp sp sp sp cancel unconstitutional executive orders cut sanctuary city funding and deport criminal aliens,20
sp sp sp sp sp sp well if they had kept their mouth shut that movie would have been fabulous,20
sp sp sp sp sp sp sp sp sp sp sp sp sp sp sp sp sp over praise,19
sp sp sp sp sp sp sp sp sp sp sp sp sp sp sp sp sp over praise,19
sp sp sp sp sp sp sp sp sp sp sp sp that way sp remember what talking about,19
sp no other accessories you got your resume your pictures make sure that you got your outfit your ready research,20
that you wear a stud earring that will not cover your ears make sure you wear only a wrist watch,20
sp sp sp sp sp sp sp sp girls for guys make sure that you have a three piece suit,20
kind of outfit they have make sure that you resemble the color cut and style for guys and girls for,20
sp sp sp sp inside and then after graduation our intention to promote these people into full time staff,19
sp so really a culture of promotion from within a great jump off opportunity to start a career,18
sp had great luck here in the past i feel like the students are a great fit for our organization,20
that that they have a great talent pool of people that love the charlotte area whether charlotte or hickory,19
sp sp sp sp sp opportunity really important to recruit young talent because sp motivated they want to work,19
we can choose from so sp always looking for diverse individuals that are looking for a sales opportunity really,19
sp sp sp sp sp sp sp sp sp sp sp sp company sp gotta start somewhere you want someone,20
sp sp sp sp sp sp sp sp sp sp sp one of the future of our company sp gotta,20
and to be in front of all these students that are ready to get out there and work hard,19
this level obviously interested in these career fairs someone not interested is not gonna be here so sp,18
look for just somebody's going to come in and work hard no matter what sp going to do,18
sp sp sp sp sp work hard the biggest thing that i think that we look for just,18
sp sp sp sp sp sp sp sp been coming i think this is my fifth year doing this fair,20
sp sp sp sp sp sp sp sp sp sp sp sp but sp here at on sp been coming,20
sp sp sp sp sp sp very supportive of the vendors which i love not all the campuses are,19
sp sp sp sp sp sp sp sp sp sp sp sp sp they do sp do a great job,20
really appreciate the effort that sp put into this and the quality of the students i get we have an,20
sp sp sp sp and i get a good mix of students from a variety of majors and backgrounds sp,20
feel like sp recruited some individuals from here so from the fair so been really really nice we,18
sp been coming for the last probably i know four years as long as sp been with the organization,19
from so we look at this as an opportunity to bring people onto our organization developing train give our interns,20
sp sp train give our interns an opportunity to see our business and industry from the inside and then after,20
sp sp sp sp the great thing about running in a project management system is you can track going on,20
and if you have any more questions love to hear from your and your comments just right below down here,20
which is an online system which you just have to pay monthly fee and everything runs online there for you,20
to hear any further interesting topics that you might want me to talk about and share with you as well,20
sp sp sp sp sp sp sp sp sp have a great day and see you in the next video,20
sp sp sp sp sp sp sp sp sp have a great day and see you in the next video,20
sp sp sp sp sp sp sp sp sp so what i recommend doing to use a project management system,20
sp sp sp sp sp sp sp sp sp sp sp sp sp go to the and save your souls,20
sp sp sp sp for you some examples of feeling ill are experiencing chest pains or a woman in labor,20
breaks down you can use this icon to show the officer that you are in need of a tow truck,20
sp sp sp sp sp sp sp in labor if you are lost the officer can provide you directions if,20
sp sp sp sp sp sp sp sp sp sp sp sp sp sp slap fit for a soap opera,20
sp sp sp sp mexican star eduardo yanez slapped univision reporter paco fuentes on the hollywood's red carpet on tuesday,20
i am in the research seminar featuring dr jensen and umm in a small classroom of like to like people,20
operators and travel agents to be smarter with the of their marketing activity for the complete article please go to,20
powerful role in the holiday destination decision making process with of overseas and of domestic travel transactions now digitally influenced,20
so fun diverse it requires good communication skills and we also enjoy just hanging around talking about flying,18
so fun diverse it requires good communication skills and we also enjoy just hanging around talking about flying,18
loans at reasonable rates if an investor you can stand a make a bit of money with wise loans,19
sp sp so if borrower this peer to peer lending network might be just what sp been looking for,19
an score of or higher but to ensure that the lending peers take too much of a risk,18
sp sp so if borrower this peer to peer lending network might be just what sp been looking for,19
sp sp sp sp now take this quails and then apply the all out just into the gashes just apply,20
sp sp sp just this is going to be kind of a dry paste that is how we want it,20
crowd of twenty thirty thousand people came down to where the dutch base was located from srebrenica on july afternoon,20
sp sp sp sp sp sp sp sp sp sp sp sp sp sp sp sp sp been missing for,20
that the only way to survive was to remain on the compound for as long as possible with the dutch,20
sp sp sp sp sp sp sp sp sp sp sp sp sp sp sp sp sp been missing for,20
people did at this point i realized that franken was going to allow my father to remain on the base,20
bigger knowledge base on what it is that they want to talk to the doctor about and this helps them,20
about their illness and just sit like they did in the previous generations where the doctor was almost god's,19
sp sp sp sp sp sp sp sp reply congratulations getting a brand new clean share a smile shirt,19
if you remember i said that i was going to give away two gummy and a share a smile shirt,20
i put them in a list and gave them all an independent number then i went to the streets if,20
sp sp sp sp sp sp sp sp sp and so thanks to this that picked a random number the,20
to and hey i need two numbers anyone first two people to reply pick a random number between and so,20
sp sp sp sp sp sp sp sp number the winner of the first gummy is going to be ashley,20
sp sp sp sp sp sp sp sp sp sp sp sp sp gamer you won yourself a free then,20
sp sp sp sp sp sp sp sp the next winner thanks to this is going to be gamer you,20
hey someone better reply to this tweet and give me a random number and here was the very first reply,20
sp sp sp sp sp sp free then finally for the free share a smile shirt i went to and,20
use the same base line the same code base and tweak it to their needs to meet their verification goals,20
loans from a thousand dollars up to thirty five thousand dollars to people that are just getting started in business,20
sp sp sp sp sp and just be as creative as you can and hopefully your business will be successful,20
that the only place to go to get a loan or financing would be a bank or a financial institution,20
and pitch to them their idea and see if someone can give five hundred dollars another person a thousand dollars,20
sp a certified financial planner with financial management and you can learn more about my company or my services at,20
chance to take a look at how the mutual fund has performed in up markets and also in down markets,20
sp sp sp ideally you would want to choose a mutual fund that has ideally a ten year track record,20
the third things that going to want to take a look at is the strategy of the mutual fund,19
needs a space where they can define themselves and not be pre defined by the information that exists about them,20
who had our information and what they could do with the information we could truly as individuals police the market,20
sp sp sp sp sp sp sp sp sp sp sp sp sp sp sp sp sp sp sp any,20
i could tell stories and i could paint who i am based on the stories i painted in that room,20
concept of setting up a set of rules that organizations then become good stewards by abiding by those rules any,20
sp sp sp sp so in the old days i could define myself based on the stories that i told,20
sp sp sp sp sp sp sp sp i wrote an article on and being boxed in by our information,20
because the job i care most about is my successor it is the most important job in nebraska it was,20
sp sp sp sp sp sp sp sp sp sp sp sp sp sp for us senate or attorney's general,20
it yesterday i sleep a wink and i sleep much last night either so i was pretty excited,18
sp sp sp sp nebraska it was rocket fuel for my campaign and i believe that to be true i,20
sp sp sp sp sp sp sp sp sp sp sp good evening thanks for joining us sp katie gauthier,20
sp sp sp sp sp sp sp nebraska governor sp has decided to back jon bruning as his successor with,20
sp sp sp sp sp us sp katie gauthier an endorsement that could help swing votes in nebraska governor,19
sp sp sp sp sp sp sp sp sp sp sp sp sp the two were in kearney today sp,20
sp sp sp sp with five days left in the race for governor bruning has all the momentum the two,20
sp easy one he said he spent a lot of time watching the debates on tv and the internet just,20
sp sp sp sp sp sp sp said his decision to endorse bruning sp an easy one he said he,20
sp sp sp internet just how powerful is this endorsement sp says he sp be backing any candidates for us,20
non believing perspective treating what is too many people sacred scripture you might get more friction and controversy there too,20
sp sp sp sp sp i really look forward to discussing with my students their take on the noah movie,20
about using the sacred scriptures of particular faiths to create modern entertainment and sp ethics in that there definitely are,20
sp sp sp sp sp sp sp sp sp sp sp sp sp sp sp stutter was like dungeons and,20
sp sp sp movie is absolutely horrible so umm how do they finance this who said who who stutter was,20
sp sp sp sp sp sp sp sp sp sp sp sp sp sp sp sp sp sp good movie,20
sp sp sp sp sp sp sp sp sp sp sp sp sp sp and dragons a good movie,19
sp sp sp sp sp sp sp yeah sp get him in there sp sp stutter great at these serious,20
sp sp sp sp sp sp sp sp sp sp sp sp sp sp sp sp sp movie marlon wayans,20
sp sp sp sp sp sp sp sp sp sp sp sp sp sp sp sp sp roles who dungeons,20
sp sp sp sp sp sp sp sp sp sp sp sp sp sp sp sp sp sp sp sp,20
sp sp sp sp sp sp sp sp sp sp sp line okay a really bad dungeons,17
sp sp sp sp sp sp sp sp sp sp sp sp sp sp sp sp sp sp sp dragons,20
sp sp sp sp sp sp sp sp sp sp sp sp sp sp sp sp sp sp and dragons,20
sp sp sp sp sp sp sp sp sp sp sp sp watch it not good at i,18
sp sp sp sp sp sp sp sp sp sp sp sp sp sp sp sp sp on like,19
sp sp sp sp sp sp sp sp sp sp sp sp sp the plus side got two audio,19
sp sp why they made it it sp entertaining it sp even like the funny kind of i guess for,20
sp sp sp sp sp sp but why would you want to watch any of that when the movie is,20
sp sp sp sp sp sp sp sp audio commentaries and two documentaries and deleted scenes and uhh special effects,20
sp sp sp sp sp sp sp sp sp sp which of the statements below do you think are true,20
sp sp sp sp sp sp sp sp sp enough i had to walk out people before me were walking,20
sp sp sp sp sp sp production it was just umm sp say about halfway through the movie i had,20
is currently in theaters now i was a sp a fan of fantasy movies so when i saw some of,20
sp sp sp sp sp sp sp sp sp sp sp sp line hi i am reviewing the movie which,20
sp sp sp sp sp sp sp sp sp sp sp sp sp sp sp a fan of fantasy movies,20
sp sp of the commercials for this i thought alright sp gonna go check this movie if you stutter,19
sp sp sp sp sp sp sp sp sp sp that do not see this movie it was a horrible,20
sp sp sp sp sp sp sp sp sp sp sp sp sp sp any type of movie for that,20
sp sp sp sp sp sp sp sp awful if you ask umm i thought i understand how some,19
sp sp sp sp sp sp sp umm it was just a mess the dialogues were horrible performances were stutter,20
sp sp sp sp sp sp sp sp sp sp sp sp and put it out for production it was,20
sp sp sp sp sp sp sp sp sp sp sp sp sp sp sp people could approve this movie,20
first tell everyone in the environment to stop using or limit the use of the sp name throughout the day,20
sp sp sp sp sp sp the following is an excerpt from page of my book the verbal behavior approach,20
respond to his name when called because he sp tune you out as part of a long list of demands,20
last video do not link the sp name to demands such as dennis go get your shoes dennis come here,20
standing a foot or two farther away and by delaying the touching of a shoulder by a second or two,20
name while standing behind him and then immediately touch a shoulder and hand him a chip or blow the bubbles,20
and the reinforcement can be systematically faded out and your client will become more successful with responding to his name,20
sp sp sp sp sp by using this procedure dennis will learn that when he his name good things happen,20
over to my website and leave me a comment there or share this video on your favorite social media channel,20
sp sp sp sp sp sp sp if watching this video anywhere other than on my page at hop,19
sp sp sp sp sp sp sp dr mary's barbara autism mom board certified behavior analyst and best selling author's,20
learn to respond to their names when called which is a huge skill that many children with autism struggle with,20
last week my video was all about not overusing a sp name especially when placing a demand or saying no,20
autism and toddlers or the m chat and a diagnostic indicator on the autism diagnostic observation schedule known as the,20
sp a child not responding to his name once called can be one of the first hallmark signs of autism,20
children to respond to their names with dozens of children with autism and have found it to be very successful,20
children with autism have difficulty responding to their name i thought i would address it in this sp video i,20
sp sp sp sp sp sp sp sp sp sp sp since any behavior reinforced should maintain or increase,19
sp sp sp sp the key here is to pair the sp name with improving conditions which is called reinforcement,20
then took the opportunity to come back up to scotland because there many buying jobs in scotland three years ago,20
sp sp sp sp i got to this position really by working in the retail industry for a long time,20
marketing side or retail there are all sorts of degrees appropriate to the industry and again work in a supermarket,20
a career in the food industry is to get involved with the suppliers at an early age know your products,20
but it gives you that real learning about products and speaking to customers and helps you understand the whole industry,20
but it gives you that real learning about products and speaking to customers and helps you understand the whole industry,20
giving a big new contract or a new listing to in particular a small supplier because where it means jobs,20
but it gives you that real learning about products and speaking to customers and helps you understand the whole industry,20
products to listing them on your shelves that affects jobs and communities it goes all the way down the chain,20
stores it could mean an extra five or six jobs at that particular supplier so always a good good moment,20
you can have to different suppliers and actually to employment so absolutely fundamental it helps the whole scottish food industry,20
our head office government bodies all sorts of suppliers and other people so being a key communicator is absolutely essential,20
spent doing the number crunching analysis a boring part but it needs to be done all part of the job,20
sp sp sp sp sp sp sp sp the movie tried really really hard uhh to be funny and failed,20
it felt really solid and like it was going to be a good movie and in the middle of the,20
sp sp sp sp sp sp sp sp sp sp funny at all i like maybe laughed sp say maybe,20
sp sp sp sp sp sp sp sp sp sp sp spectacularly uhh it was it was stutter not funny,20
sp sp sp sp sp sp sp sp sp sp sp sp sp sp sp sp over the course of,20
sp sp sp sp sp sp sp sp sp sp sp sp times one time pretty hard at something that,20
sp sp sp sp sp sp sp sp laughing five times at a part that is uhh supposed to be,20
sp sp sp sp sp sp sp sp sp sp sp sp sp sp course of forty minutes laughing five,20
uhh jim parsons and i absolutely hated him uhh there is no way that any normal human being would invite,20
sp sp sp sp sp sp sp sp sp sp to be funny from start to finish umm that just,20
sp sp sp sp sp sp sp sp sp sp sp sp sp sp sp is this movie this movie,20
sp sp sp sp sp sp sp sp sp sp sp sp sp line hello playing over my shoulder is,20
sp sp sp sp sp sp i like this movie and sp tell you why because three people,18
sp sp sp sp sp sp sp sp sp sp sp sp sp this movie is called the signal i,20
sp sp sp sp sp sp sp sp sp sp broadcast from an uhh unspecified source uhh over television waves,20
same cast from beginning to end and about uhh some sort of a strange signal that is uhh broadcast,19
sp sp sp sp sp sp sp sp sp sp sp sp sp sp sp and regular phone lines and,20
sp sp sp sp sp sp sp sp sp sp sp and uhh radio waves and cellular phones and regular,20
out and start killing each other and the first third of the movie i really enjoyed i thought it was,20
sp sp sp sp sp sp sp sp and uhh it just drives people insane it uhh makes them want,20
sp sp sp sp sp sp sp sp sp to teach the focus of that class is personal narrative i,20
rachel woodburn and i teach digital storytelling at scottsdale community college one of my favorite classes to teach the,19
sp sp sp sp sp sp sp sp sp sp sp sp sp sp ca when it came to maricopa,20
of over a decade ago not only attending a workshop from the center for digital storytelling in berkeley ca when,20
sp sp sp and sp joe ortiz and sp been teaching this digital storytelling class for two years now i,20
there and we started that class together because we wanted all of our students to experience what we had experienced,20
rachel sp learned a great deal more about the technique of digital storytelling particularly from a design and artistic standpoint,20
i took over for linda hicks who retired and sp thoroughly enjoyed teaching the class with rachel sp learned a,20
strategy to me just another vehicle to reach your customers and in the future sp be an indispensable vehicle,19
sp sp sp sp sp sp sp sp you may now move onto the next section of this orientation good,20
sp congratulations you made it to the end of this segment and successfully answered all the quiz questions correctly you,20
sp sp sp sp sp digitally is all about everyone being connected to everyone else in anything sp interested in,20
sp sp sp sp sp sp sp sp sp sp sp sp sp actually a critical year for that,19
two clicks away from finding out whether someone has actually done what they said they were going to do,19
sp sp sp sp sp sp what we have is a world in which there is a transparency of actions,20
sp sp sp sp sp sp sp sp sp sp sp sp the of which is a digital marketing network,20
sp sp sp sp sp sp sp actually again i think that digital is going to be the key driver's,20
sp sp sp sp sp sp sp sp sp sp sp sp sp actually a critical year for that,19
sp sp sp sp sp sp sp sp anything that can be done digitally will start to be done digitally,20
the business processes the more that go digital the more impact they are going to have in the physical world,20
you really need to grab them and speak to in a way that they understand and that they connect with,20
tools you are likely to connect with only about of the intended recipients at any given time and for that,20
a message that is short and sweet enough that you could deliver it in a short elevator ride guys have,20
the first lesson on how to effectively present your idea is to have what is called an elevator pitch an,20
video i talked about finding a quick way to describe your company in relation to what the audience loves like,20
sp sp sp sp sp sp sp sp one version of an elevator pitch but there are definitely more the,20
sp sp sp sp sp sp sp sp sp sp sp more the second lesson is to be visual more,20
of it anymore i just stop and feel it sp here for my family again not trapped in the grief,20
her struggle with something that she used to do without even thinking about it sp have to leave the room,20
sp sp sp sp sp sp sp sp something about her was gone had died i guess you could say,20
sp sp sp when i realized that that something in her had died i finally gave myself permission to grieve,20
that to be an idea that the world that we live in today could certainly use a lot more of,20
sp sp more rock like structures than the ones that you used to get and add that to the mix,20
sp sp sp sp sp sp sp sp sp sp have a great day and good luck on your exam,20
sp sp sp sp sp sp hi and welcome to our informational video about the investment banking representative qualification exam,20
sp sp sp mergers and acquisitions tender offers and financial restructuring transactions consists of questions making up of the score,20
and new financing transactions types of offerings and registration of securities has questions and counts for of the total score,20
sp sp sp sp sp sp and general securities industry regulations has questions and makes up of the exam score,20
in the video description below or search for series we hope you have enjoyed our video and found it helpful,20
this digital age we need to equip ourselves with software that our processes our people and ultimately that customer experience,20
sp sp sp sp sp sp sp sp sp sp sp sp sp sp to this day sp great what,20
sp sp sp sp sp sp sp sp sp sp sp sp sp corporate at batteries plus bulbs was amazing,20
sp sp sp sp sp sp sp sp sp sp sp sp sp talked to so many different people they,20
what i liked about it is when i had a question i picked up the phone i could call anyone,20
sp sp they are more than willing to help me with day to day operations looking into the future so,20
sp so opening the store was it a challenge yes because i have never done anything as far as retail,20
sp sp sp sp sp to at an estimated cost of an the price for have been several hundred thousand,20
sp sp sp sp sp sp sp sp sp sp sp sp we need tax cuts and tax reform now,20
sp sp sp how little he moves his mouth when he talks like his teeth separate almost like,18
sp sp sp sp sp sp sp bit a little bit weird how he moves his mouth how little,19
sp sp sp sp sp sp sp sp sp the same time like what what is going on here,19
sp sp sp sp sp sp sp almost like sp the and the dummy at the same time like,19
sp sp sp uh now you might be thinking trevor i recognize the name but not from tax news well,20
sp sp sp sp sp sp sp sp sp sp sp going on here how i speak to people,19
that he and his new wife be allowed to travel in style in a government on their honeymoon to at,20
sp news well maybe because last month he tried to get you to pay for his honeymoon reporter married,19
sp sp what a viewer realize is that sp in focus is actually the mirrored image of the woman,19
sp sp sp sp sp sp sp sp sp sp sp sp sp sp sp and it begins in focus,20
the most important thing is that through the eye of the video you cannot tell real from mirror any longer,20
sp sp sp sp sp sp sp sp sp sp sp sp not the actual image of the woman,19
sp sp sp sp sp sp each time i go toward the mirror sp the one sp out of focus,20
sp sp sp sp sp sp sp sp sp sp sp sp sp sp this is patrick munro financial adviser,20
a great wealth building tool going forward that works best when real estate house values are going up in value,20
sp sp sp sp sp sp sp sp sp in this series sp be talking about automation and pro tools,20
be the same sound the same volume the same place you want it to be and how you automate,19
or a lawyer looking to grow your practice for the long term then seo is the perfect solution for you,20
sp sp here today because committed to getting more clients and cases on the books for your firm,18
sp sp sp sp sp new york or los angeles go for something a little get the uhh audience of,20
sp sp sp sp sp sp sp sp sp sp sp sp sp props for that that they use,19
sp sp sp sp sp sp sp sp sp the nineties otherwise they sp probably used new york for the,20
sp sp sp sp sp sp sp sp sp sp sp sp sp sp sp course filmed in the,19
sp sp sp sp sp sp sp sp sp sp sp sp sp sp sp out to stop an umm,20
sp sp sp sp sp sp directed by ron howard stars uhh kurt russel and william baldwin as two chicago,20
sp sp sp sp sp sp sp sp and for a murder thriller drama starring firefighters not all that,19
sp sp has a good strong supporting cast including donald sutherland and robert de niro however aged quite a,19
sp sp sp sp sp sp sp sp sp sp sp baldwin one of the worst of the baldwin brothers,20
sp sp sp sp sp sp sp sp sp sp of a movie umm for one thing it has william,20
sp sp sp sp sp sp the whole concept of back draft which a lot of people really know,19
sp sp sp sp sp sp sp sp sp sp in some interesting use of fire particularly the whole,19
sp sp sp sp sp sp sp sp sp sp sp sp city which gotta give props for that that,20
sp sp sp sp sp sp sp sp sp sp sp sp sp starts in chicago which is my favorite,20
come here for the cinematic stuff for the which is what i love to spread the relationship stuff the the,20
sp sp sp sp sp sp sp sp sp the the corking is the around they always having fun whatever,20
sp sp sp sp sp sp sp sp sp sp sp and likely to lead to also lesser profits,19
prices and profits as much as we would like to see or at least what the lab studies would suggest,20
sp sp sp sp sp sp sp sp sp sp use the highlighted total assets to determine the debt ratio,20
